{
  "session_id": "baseline1-sympy__sympy-23824-1",
  "task_id": "sympy__sympy-23824",
  "job_id": "baseline1",
  "trial": 1,
  "harness": "droid",
  "assistant_turns": 13,
  "tool_calls": 12,
  "token_usage": {
    "input_tokens": 28,
    "output_tokens": 3529,
    "cache_creation_tokens": 10833,
    "cache_read_tokens": 237508,
    "thinking_tokens": 418,
    "factory_credits": 2206
  },
  "timed_out": false,
  "calls": [
    {
      "tool_call_id": "toolu_01GzuAX4MfGyXdoVXZjDXZEX",
      "position": 0,
      "turn": 0,
      "tool_name": "Execute",
      "command_class": "search",
      "test_runner": null,
      "path_arg_count": null,
      "background": false,
      "duration_s": 0.078,
      "is_error": false,
      "exit_code": 0,
      "files": [],
      "output_chars": 414,
      "output_tokens_est": 103,
      "turns_after": 12,
      "repeats_earlier": false
    },
    {
      "tool_call_id": "toolu_01SGamMuLTpfR2CrkrrY5rxK",
      "position": 1,
      "turn": 1,
      "tool_name": "Read",
      "command_class": "read",
      "test_runner": null,
      "path_arg_count": null,
      "background": false,
      "duration_s": 0.014,
      "is_error": false,
      "exit_code": null,
      "files": [
        "sympy/physics/hep/gamma_matrices.py"
      ],
      "output_chars": 3584,
      "output_tokens_est": 896,
      "turns_after": 11,
      "repeats_earlier": false
    },
    {
      "tool_call_id": "toolu_015K7a9PxRbzo7DEXovyQs1B",
      "position": 2,
      "turn": 2,
      "tool_name": "Read",
      "command_class": "read",
      "test_runner": null,
      "path_arg_count": null,
      "background": false,
      "duration_s": 0.012,
      "is_error": false,
      "exit_code": null,
      "files": [
        "sympy/physics/hep/gamma_matrices.py"
      ],
      "output_chars": 6962,
      "output_tokens_est": 1740,
      "turns_after": 10,
      "repeats_earlier": false
    },
    {
      "tool_call_id": "toolu_01PqLFoAPuUpYrwKvXfMmn91",
      "position": 3,
      "turn": 3,
      "tool_name": "Read",
      "command_class": "read",
      "test_runner": null,
      "path_arg_count": null,
      "background": false,
      "duration_s": 0.009,
      "is_error": false,
      "exit_code": null,
      "files": [
        "sympy/physics/hep/gamma_matrices.py"
      ],
      "output_chars": 2604,
      "output_tokens_est": 651,
      "turns_after": 9,
      "repeats_earlier": false
    },
    {
      "tool_call_id": "toolu_01EpmjKicTePWz8JT2Da5r5H",
      "position": 4,
      "turn": 4,
      "tool_name": "Execute",
      "command_class": "run",
      "test_runner": null,
      "path_arg_count": null,
      "background": false,
      "duration_s": 3.0,
      "is_error": false,
      "exit_code": 0,
      "files": [],
      "output_chars": 161,
      "output_tokens_est": 40,
      "turns_after": 8,
      "repeats_earlier": false
    },
    {
      "tool_call_id": "toolu_01LENGrmT8DNZbQG7kNiCrzn",
      "position": 5,
      "turn": 5,
      "tool_name": "Edit",
      "command_class": "edit",
      "test_runner": null,
      "path_arg_count": null,
      "background": false,
      "duration_s": 0.021,
      "is_error": false,
      "exit_code": null,
      "files": [
        "sympy/physics/hep/gamma_matrices.py"
      ],
      "output_chars": 963,
      "output_tokens_est": 240,
      "turns_after": 7,
      "repeats_earlier": false
    },
    {
      "tool_call_id": "toolu_01PambhJiFSqTckkaHQwrhCB",
      "position": 6,
      "turn": 6,
      "tool_name": "Execute",
      "command_class": "test",
      "test_runner": "pytest",
      "path_arg_count": 1,
      "background": false,
      "duration_s": 1.268,
      "is_error": false,
      "exit_code": 0,
      "files": [
        "sympy/physics/hep/tests/test_gamma_matrices.py"
      ],
      "output_chars": 228,
      "output_tokens_est": 57,
      "turns_after": 6,
      "repeats_earlier": false
    },
    {
      "tool_call_id": "toolu_01KnB1hugvnc3HjjtkoAyWQm",
      "position": 7,
      "turn": 7,
      "tool_name": "Execute",
      "command_class": "test",
      "test_runner": "sympy_bin_test",
      "path_arg_count": 1,
      "background": false,
      "duration_s": 10.511,
      "is_error": false,
      "exit_code": 0,
      "files": [
        "sympy/physics/hep/tests/test_gamma_matrices.py"
      ],
      "output_chars": 327,
      "output_tokens_est": 81,
      "turns_after": 5,
      "repeats_earlier": false
    },
    {
      "tool_call_id": "toolu_01HsfdFiekZrvs7HxQxiU9N4",
      "position": 8,
      "turn": 8,
      "tool_name": "Grep",
      "command_class": "search",
      "test_runner": null,
      "path_arg_count": null,
      "background": false,
      "duration_s": 0.02,
      "is_error": false,
      "exit_code": null,
      "files": [
        "sympy/physics/hep/tests/test_gamma_matrices.py"
      ],
      "output_chars": 341,
      "output_tokens_est": 85,
      "turns_after": 4,
      "repeats_earlier": false
    },
    {
      "tool_call_id": "toolu_01TJgiCPVupQpnSJV24hbi88",
      "position": 9,
      "turn": 9,
      "tool_name": "Read",
      "command_class": "read",
      "test_runner": null,
      "path_arg_count": null,
      "background": false,
      "duration_s": 0.009,
      "is_error": false,
      "exit_code": null,
      "files": [
        "sympy/physics/hep/tests/test_gamma_matrices.py"
      ],
      "output_chars": 271,
      "output_tokens_est": 67,
      "turns_after": 3,
      "repeats_earlier": false
    },
    {
      "tool_call_id": "toolu_01LPJX3uEw3T5fncQq5zrcTM",
      "position": 10,
      "turn": 10,
      "tool_name": "Edit",
      "command_class": "edit",
      "test_runner": null,
      "path_arg_count": null,
      "background": false,
      "duration_s": 0.015,
      "is_error": false,
      "exit_code": null,
      "files": [
        "sympy/physics/hep/tests/test_gamma_matrices.py"
      ],
      "output_chars": 1786,
      "output_tokens_est": 446,
      "turns_after": 2,
      "repeats_earlier": false
    },
    {
      "tool_call_id": "toolu_011qa9AmyNp7ZVgtz6XV15U4",
      "position": 11,
      "turn": 11,
      "tool_name": "Execute",
      "command_class": "test",
      "test_runner": "sympy_bin_test",
      "path_arg_count": 1,
      "background": false,
      "duration_s": 10.533,
      "is_error": false,
      "exit_code": 0,
      "files": [
        "sympy/physics/hep/tests/test_gamma_matrices.py"
      ],
      "output_chars": 283,
      "output_tokens_est": 70,
      "turns_after": 1,
      "repeats_earlier": false
    }
  ]
}
