{
  "session_id": "baseline1-sympy__sympy-13757-2",
  "task_id": "sympy__sympy-13757",
  "job_id": "baseline1",
  "trial": 2,
  "harness": "droid",
  "assistant_turns": 14,
  "tool_calls": 18,
  "token_usage": {
    "input_tokens": 30,
    "output_tokens": 6443,
    "cache_creation_tokens": 15701,
    "cache_read_tokens": 267347,
    "thinking_tokens": 1881,
    "factory_credits": 3151
  },
  "timed_out": false,
  "calls": [
    {
      "tool_call_id": "toolu_012NCTBtQ7GA7wZvtFJDeFA2",
      "position": 0,
      "turn": 0,
      "tool_name": "Grep",
      "command_class": "search",
      "test_runner": null,
      "path_arg_count": null,
      "background": false,
      "duration_s": 0.039,
      "is_error": false,
      "exit_code": null,
      "files": [
        "sympy/core/decorators.py"
      ],
      "output_chars": 1673,
      "output_tokens_est": 418,
      "turns_after": 13,
      "repeats_earlier": false
    },
    {
      "tool_call_id": "toolu_019nRgDU2JyWGkL8E8vifMYo",
      "position": 1,
      "turn": 0,
      "tool_name": "Grep",
      "command_class": "search",
      "test_runner": null,
      "path_arg_count": null,
      "background": false,
      "duration_s": 0.044,
      "is_error": false,
      "exit_code": null,
      "files": [
        "sympy/polys/polytools.py"
      ],
      "output_chars": 56,
      "output_tokens_est": 14,
      "turns_after": 13,
      "repeats_earlier": false
    },
    {
      "tool_call_id": "toolu_017CoaWKU6abNhpQT5yqJgST",
      "position": 2,
      "turn": 0,
      "tool_name": "Grep",
      "command_class": "search",
      "test_runner": null,
      "path_arg_count": null,
      "background": false,
      "duration_s": 0.046,
      "is_error": false,
      "exit_code": null,
      "files": [
        "sympy/core/expr.py"
      ],
      "output_chars": 3400,
      "output_tokens_est": 850,
      "turns_after": 13,
      "repeats_earlier": false
    },
    {
      "tool_call_id": "toolu_01Wp8dN6yvNEvdGjT35kC9mn",
      "position": 3,
      "turn": 1,
      "tool_name": "Read",
      "command_class": "read",
      "test_runner": null,
      "path_arg_count": null,
      "background": false,
      "duration_s": 0.015,
      "is_error": false,
      "exit_code": null,
      "files": [
        "sympy/polys/polytools.py"
      ],
      "output_chars": 891,
      "output_tokens_est": 222,
      "turns_after": 12,
      "repeats_earlier": false
    },
    {
      "tool_call_id": "toolu_01RYyfFBbnCFpSf1puZd5q98",
      "position": 4,
      "turn": 1,
      "tool_name": "Grep",
      "command_class": "search",
      "test_runner": null,
      "path_arg_count": null,
      "background": false,
      "duration_s": 0.033,
      "is_error": false,
      "exit_code": null,
      "files": [
        "sympy"
      ],
      "output_chars": 1178,
      "output_tokens_est": 294,
      "turns_after": 12,
      "repeats_earlier": false
    },
    {
      "tool_call_id": "toolu_01G8cY5oZeiGbFNjAPAvpSut",
      "position": 5,
      "turn": 2,
      "tool_name": "Read",
      "command_class": "read",
      "test_runner": null,
      "path_arg_count": null,
      "background": false,
      "duration_s": 0.014,
      "is_error": false,
      "exit_code": null,
      "files": [
        "sympy/polys/polytools.py"
      ],
      "output_chars": 854,
      "output_tokens_est": 213,
      "turns_after": 11,
      "repeats_earlier": false
    },
    {
      "tool_call_id": "toolu_01RmR4Q2zvXU2StkedbqUT61",
      "position": 6,
      "turn": 3,
      "tool_name": "Read",
      "command_class": "read",
      "test_runner": null,
      "path_arg_count": null,
      "background": false,
      "duration_s": 0.01,
      "is_error": false,
      "exit_code": null,
      "files": [
        "sympy/polys/polytools.py"
      ],
      "output_chars": 490,
      "output_tokens_est": 122,
      "turns_after": 10,
      "repeats_earlier": false
    },
    {
      "tool_call_id": "toolu_01E1JAD6ARqLMDwzCYQK1mA8",
      "position": 7,
      "turn": 4,
      "tool_name": "Edit",
      "command_class": "edit",
      "test_runner": null,
      "path_arg_count": null,
      "background": false,
      "duration_s": 0.061,
      "is_error": false,
      "exit_code": null,
      "files": [
        "sympy/polys/polytools.py"
      ],
      "output_chars": 868,
      "output_tokens_est": 217,
      "turns_after": 9,
      "repeats_earlier": false
    },
    {
      "tool_call_id": "toolu_011G1ch3Tgiy8HeTYK2Ytcoe",
      "position": 8,
      "turn": 4,
      "tool_name": "Execute",
      "command_class": "run",
      "test_runner": null,
      "path_arg_count": null,
      "background": false,
      "duration_s": 2.643,
      "is_error": false,
      "exit_code": 0,
      "files": [],
      "output_chars": 1093,
      "output_tokens_est": 273,
      "turns_after": 9,
      "repeats_earlier": false
    },
    {
      "tool_call_id": "toolu_01MrJtVw8NSG8SdxdbTN9rtN",
      "position": 9,
      "turn": 5,
      "tool_name": "Execute",
      "command_class": "test",
      "test_runner": "pytest",
      "path_arg_count": 4,
      "background": false,
      "duration_s": 0.274,
      "is_error": false,
      "exit_code": 0,
      "files": [
        "sympy/polys/tests/test_polytools.py",
        "sympy/core/tests/test_priority.py",
        "sympy/core/tests/test_arit.py",
        "sympy/matrices/tests/test_immutable.py"
      ],
      "output_chars": 94,
      "output_tokens_est": 23,
      "turns_after": 8,
      "repeats_earlier": false
    },
    {
      "tool_call_id": "toolu_011Wx3fYn5Vxy87TLMYHx6Vf",
      "position": 10,
      "turn": 6,
      "tool_name": "Execute",
      "command_class": "test",
      "test_runner": "sympy_bin_test",
      "path_arg_count": 1,
      "background": false,
      "duration_s": 12.829,
      "is_error": false,
      "exit_code": 0,
      "files": [],
      "output_chars": 584,
      "output_tokens_est": 146,
      "turns_after": 7,
      "repeats_earlier": false
    },
    {
      "tool_call_id": "toolu_01Czv7yiiMiQcDgxmpjB9RnZ",
      "position": 11,
      "turn": 7,
      "tool_name": "Execute",
      "command_class": "test",
      "test_runner": "sympy_bin_test",
      "path_arg_count": 2,
      "background": false,
      "duration_s": 16.244,
      "is_error": false,
      "exit_code": 0,
      "files": [
        "sympy/polys/tests/test_polytools.py",
        "sympy/core/tests/test_arit.py"
      ],
      "output_chars": 2983,
      "output_tokens_est": 745,
      "turns_after": 6,
      "repeats_earlier": false
    },
    {
      "tool_call_id": "toolu_01TQDbZT8pU1oMzDheZNeBNh",
      "position": 12,
      "turn": 8,
      "tool_name": "Execute",
      "command_class": "run",
      "test_runner": null,
      "path_arg_count": null,
      "background": false,
      "duration_s": 0.907,
      "is_error": false,
      "exit_code": 0,
      "files": [],
      "output_chars": 1693,
      "output_tokens_est": 423,
      "turns_after": 5,
      "repeats_earlier": false
    },
    {
      "tool_call_id": "toolu_01PadBritzUBk9t91D5B4ika",
      "position": 13,
      "turn": 9,
      "tool_name": "Execute",
      "command_class": "test",
      "test_runner": "sympy_bin_test",
      "path_arg_count": 1,
      "background": false,
      "duration_s": 4.213,
      "is_error": false,
      "exit_code": 0,
      "files": [
        "sympy/core/tests/test_arit.py"
      ],
      "output_chars": 2296,
      "output_tokens_est": 574,
      "turns_after": 4,
      "repeats_earlier": false
    },
    {
      "tool_call_id": "toolu_018Hnvi6RkunxqfnfZhzwGgo",
      "position": 14,
      "turn": 10,
      "tool_name": "Execute",
      "command_class": "test",
      "test_runner": "sympy_bin_test",
      "path_arg_count": 1,
      "background": false,
      "duration_s": 7.891,
      "is_error": false,
      "exit_code": 0,
      "files": [
        "sympy/core/tests/test_arit.py"
      ],
      "output_chars": 353,
      "output_tokens_est": 88,
      "turns_after": 3,
      "repeats_earlier": false
    },
    {
      "tool_call_id": "toolu_013biVitTZYR2jXbJXJb26L3",
      "position": 15,
      "turn": 11,
      "tool_name": "Execute",
      "command_class": "test",
      "test_runner": "sympy_bin_test",
      "path_arg_count": 1,
      "background": false,
      "duration_s": 8.318,
      "is_error": false,
      "exit_code": 0,
      "files": [
        "sympy/core/tests/test_arit.py"
      ],
      "output_chars": 2492,
      "output_tokens_est": 623,
      "turns_after": 2,
      "repeats_earlier": false
    },
    {
      "tool_call_id": "toolu_018oS2AWU8XNxvrg7vau5ttc",
      "position": 16,
      "turn": 12,
      "tool_name": "Edit",
      "command_class": "edit",
      "test_runner": null,
      "path_arg_count": null,
      "background": false,
      "duration_s": 0.04,
      "is_error": false,
      "exit_code": null,
      "files": [
        "sympy/polys/tests/test_polytools.py"
      ],
      "output_chars": 762,
      "output_tokens_est": 190,
      "turns_after": 1,
      "repeats_earlier": false
    },
    {
      "tool_call_id": "toolu_0142c4qnQckV3FWKnX6rj2Zp",
      "position": 17,
      "turn": 12,
      "tool_name": "Execute",
      "command_class": "test",
      "test_runner": "sympy_bin_test",
      "path_arg_count": 1,
      "background": false,
      "duration_s": 119.749,
      "is_error": false,
      "exit_code": 0,
      "files": [
        "sympy/polys/tests/test_polytools.py"
      ],
      "output_chars": 672,
      "output_tokens_est": 168,
      "turns_after": 1,
      "repeats_earlier": false
    }
  ]
}
